{
  "$schema": "./schema.json",
  "id": "duckdb",
  "displayName": "DuckDB",
  "keywords": [
    "ABORT",
    "ABSOLUTE",
    "ACCESS",
    "ACTION",
    "ADD",
    "ADMIN",
    "AFTER",
    "AGGREGATE",
    "ALL",
    "ALSO",
    "ALTER",
    "ANALYSE",
    "ANALYZE",
    "AND",
    "ANTI",
    "ANY",
    "AS",
    "ASC",
    "ASOF",
    "ATTACH",
    "AUTHORIZATION",
    "BACKWARD",
    "BEGIN",
    "BETWEEN",
    "BIGINT",
    "BINARY",
    "BIT",
    "BOOLEAN",
    "BOTH",
    "BY",
    "CACHE",
    "CALL",
    "CALLED",
    "CASCADE",
    "CASE",
    "CAST",
    "CHECK",
    "CHECKPOINT",
    "CLASS",
    "CLOSE",
    "CLUSTER",
    "COALESCE",
    "COLLATE",
    "COLUMN",
    "COMMENT",
    "COMMIT",
    "CONSTRAINT",
    "COPY",
    "CREATE",
    "CROSS",
    "CUBE",
    "CURRENT",
    "CURRENT_DATE",
    "CURRENT_TIME",
    "CURRENT_TIMESTAMP",
    "DATABASE",
    "DEFAULT",
    "DEFERRABLE",
    "DEFERRED",
    "DELETE",
    "DESC",
    "DESCRIBE",
    "DETACH",
    "DISTINCT",
    "DO",
    "DROP",
    "ELSE",
    "END",
    "ENUM",
    "ESCAPE",
    "EXCEPT",
    "EXCLUDE",
    "EXCLUDING",
    "EXCLUSIVE",
    "EXECUTE",
    "EXISTS",
    "EXPLAIN",
    "EXPORT",
    "EXTENSION",
    "EXTERNAL",
    "EXTRACT",
    "FALSE",
    "FETCH",
    "FILTER",
    "FIRST",
    "FLOAT",
    "FOLLOWING",
    "FOR",
    "FORCE",
    "FOREIGN",
    "FORMAT",
    "FORWARD",
    "FREEZE",
    "FROM",
    "FULL",
    "FUNCTION",
    "GENERATED",
    "GLOBAL",
    "GRANT",
    "GROUP",
    "GROUPING",
    "GROUPS",
    "HAVING",
    "IDENTITY",
    "IF",
    "IGNORE",
    "ILIKE",
    "IMMEDIATE",
    "IMMUTABLE",
    "IMPORT",
    "IN",
    "INCLUDING",
    "INDEX",
    "INNER",
    "INOUT",
    "INPUT",
    "INSERT",
    "INSTALL",
    "INTERSECT",
    "INTERVAL",
    "INTO",
    "IS",
    "JOIN",
    "LATERAL",
    "LEADING",
    "LEFT",
    "LEVEL",
    "LIKE",
    "LIMIT",
    "LISTEN",
    "LOAD",
    "LOCAL",
    "LOCATION",
    "LOCK",
    "LOGICAL",
    "MATERIALIZED",
    "MERGE",
    "NATURAL",
    "NEW",
    "NEXT",
    "NO",
    "NOT",
    "NOTHING",
    "NOTIFY",
    "NULL",
    "NULLS",
    "OFFSET",
    "OLD",
    "ON",
    "ONLY",
    "OPERATOR",
    "OR",
    "ORDER",
    "OUT",
    "OUTER",
    "OVER",
    "OVERLAPS",
    "OVERLAY",
    "OWNED",
    "OWNER",
    "PARALLEL",
    "PARTITION",
    "PIVOT",
    "POSITION",
    "PRAGMA",
    "PRECEDING",
    "PREPARE",
    "PRIMARY",
    "PRIOR",
    "QUALIFY",
    "RANGE",
    "READ",
    "RECURSIVE",
    "REFERENCES",
    "RENAME",
    "REPEATABLE",
    "REPLACE",
    "RESET",
    "RESTRICT",
    "RETURNING",
    "REVOKE",
    "RIGHT",
    "ROLLBACK",
    "ROLLUP",
    "ROW",
    "ROWS",
    "SCHEMA",
    "SELECT",
    "SEMI",
    "SEQUENCE",
    "SERIALIZABLE",
    "SET",
    "SHOW",
    "SIMILAR",
    "SNAPSHOT",
    "SOME",
    "STABLE",
    "START",
    "STATEMENT",
    "STRUCT",
    "TABLE",
    "TABLESAMPLE",
    "TEMP",
    "TEMPORARY",
    "THEN",
    "TO",
    "TRAILING",
    "TRANSACTION",
    "TRIGGER",
    "TRUE",
    "TRUNCATE",
    "TYPE",
    "UNBOUNDED",
    "UNCOMMITTED",
    "UNION",
    "UNIQUE",
    "UNLISTEN",
    "UNLOGGED",
    "UNPIVOT",
    "UPDATE",
    "USE",
    "USING",
    "VACUUM",
    "VALID",
    "VALIDATE",
    "VALUE",
    "VALUES",
    "VARCHAR",
    "VARIADIC",
    "VERBOSE",
    "VIEW",
    "VOLATILE",
    "WHEN",
    "WHERE",
    "WINDOW",
    "WITH",
    "WITHIN",
    "WITHOUT",
    "WORK"
  ],
  "dataTypes": [
    "BIGINT",
    "BINARY",
    "BIT",
    "BITSTRING",
    "BLOB",
    "BOOL",
    "BOOLEAN",
    "BPCHAR",
    "BYTEA",
    "CHAR",
    "DATE",
    "DECIMAL",
    "DOUBLE",
    "ENUM",
    "FLOAT",
    "FLOAT4",
    "FLOAT8",
    "HUGEINT",
    "INT",
    "INT1",
    "INT2",
    "INT4",
    "INT8",
    "INTEGER",
    "INTERVAL",
    "JSON",
    "LIST",
    "MAP",
    "NUMERIC",
    "REAL",
    "SIGNED",
    "SMALLINT",
    "STRING",
    "STRUCT",
    "TIME",
    "TIMESTAMP",
    "TIMESTAMP_MS",
    "TIMESTAMP_NS",
    "TIMESTAMP_S",
    "TIMESTAMPTZ",
    "TINYINT",
    "UBIGINT",
    "UHUGEINT",
    "UINTEGER",
    "UNION",
    "USMALLINT",
    "UTINYINT",
    "UUID",
    "VARBINARY",
    "VARCHAR"
  ],
  "functions": [
    "ABS",
    "ACOS",
    "ACOSH",
    "AGE",
    "ANY_VALUE",
    "APPROX_COUNT_DISTINCT",
    "APPROX_QUANTILE",
    "ARG_MAX",
    "ARG_MIN",
    "ARRAY_AGG",
    "ARRAY_CONCAT",
    "ARRAY_LENGTH",
    "ARRAY_TO_STRING",
    "ASCII",
    "ASIN",
    "ASINH",
    "ATAN",
    "ATAN2",
    "ATANH",
    "AVG",
    "BAR",
    "BIT_AND",
    "BIT_COUNT",
    "BIT_OR",
    "BIT_XOR",
    "BTRIM",
    "CARDINALITY",
    "CEIL",
    "CEILING",
    "CHAR_LENGTH",
    "CHR",
    "COALESCE",
    "CONCAT",
    "CONCAT_WS",
    "CONTAINS",
    "CORR",
    "COS",
    "COSH",
    "COUNT",
    "COUNTIF",
    "COVAR_POP",
    "COVAR_SAMP",
    "CURRENT_DATE",
    "CURRENT_LOCALTIME",
    "CURRENT_LOCALTIMESTAMP",
    "CURRENT_QUERY",
    "CURRENT_SCHEMA",
    "CURRENT_SETTING",
    "DATE_ADD",
    "DATE_DIFF",
    "DATE_PART",
    "DATE_SUB",
    "DATE_TRUNC",
    "DAYNAME",
    "DEGREES",
    "DENSE_RANK",
    "ENDS_WITH",
    "EPOCH",
    "EPOCH_MS",
    "EPOCH_NS",
    "EPOCH_US",
    "EVEN",
    "EXP",
    "FACTORIAL",
    "FIRST",
    "FIRST_VALUE",
    "FLOOR",
    "FORMAT",
    "GREATEST",
    "HISTOGRAM",
    "IF",
    "IFNULL",
    "INSTR",
    "ISFINITE",
    "ISINF",
    "ISNAN",
    "LAG",
    "LAST",
    "LAST_DAY",
    "LAST_VALUE",
    "LEAD",
    "LEAST",
    "LEFT",
    "LENGTH",
    "LIST",
    "LIST_AGG",
    "LIST_CONCAT",
    "LIST_CONTAINS",
    "LIST_DISTINCT",
    "LIST_EXTRACT",
    "LIST_FILTER",
    "LIST_SORT",
    "LN",
    "LOG",
    "LOG10",
    "LOWER",
    "LPAD",
    "LTRIM",
    "MAD",
    "MAX",
    "MD5",
    "MEDIAN",
    "MIN",
    "MODE",
    "MONTHNAME",
    "NEXTAFTER",
    "NOW",
    "NTH_VALUE",
    "NTILE",
    "NULLIF",
    "OCTET_LENGTH",
    "PARSE_DIRNAME",
    "PARSE_FILENAME",
    "PI",
    "POSITION",
    "POW",
    "POWER",
    "PREFIX",
    "QUANTILE_CONT",
    "QUANTILE_DISC",
    "RADIANS",
    "RANGE",
    "RANK",
    "REGEXP_EXTRACT",
    "REGEXP_MATCHES",
    "REGEXP_REPLACE",
    "REPEAT",
    "REPLACE",
    "REVERSE",
    "RIGHT",
    "ROUND",
    "ROW_NUMBER",
    "RPAD",
    "RTRIM",
    "SETSEED",
    "SIGN",
    "SIN",
    "SINH",
    "SPLIT_PART",
    "SQRT",
    "STARTS_WITH",
    "STDDEV",
    "STDDEV_POP",
    "STDDEV_SAMP",
    "STRFTIME",
    "STRING_AGG",
    "STRPTIME",
    "STRPOS",
    "SUBSTR",
    "SUBSTRING",
    "SUM",
    "TAN",
    "TANH",
    "TIME_BUCKET",
    "TODAY",
    "TRANSLATE",
    "TRIM",
    "TRUNC",
    "TYPEOF",
    "UNNEST",
    "UPPER",
    "VAR_POP",
    "VAR_SAMP",
    "WEEKDAY",
    "XOR"
  ],
  "lexical": {
    "lineComments": [
      "--"
    ],
    "blockComments": [
      [
        "/*",
        "*/"
      ]
    ],
    "identifierQuotes": [
      "\""
    ],
    "stringQuotes": [
      "'"
    ],
    "tripleStringQuotes": [],
    "stringPrefixes": [
      "e"
    ],
    "rawStringPrefixes": [],
    "dollarQuotedStrings": true,
    "parameterModes": [
      "question",
      "dollarNumber",
      "dollarName",
      "colonName"
    ],
    "numericUnderscores": true
  }
}
