{
  "$schema": "./schema.json",
  "id": "bigquery",
  "displayName": "BigQuery (GoogleSQL)",
  "keywords": [
    "ALL",
    "AND",
    "ANY",
    "ARRAY",
    "AS",
    "ASC",
    "ASSERT_ROWS_MODIFIED",
    "AT",
    "BETWEEN",
    "BY",
    "CASE",
    "CAST",
    "COLLATE",
    "CONTAINS",
    "CREATE",
    "CROSS",
    "CUBE",
    "CURRENT",
    "DEFAULT",
    "DEFINE",
    "DESC",
    "DISTINCT",
    "ELSE",
    "END",
    "ENUM",
    "ESCAPE",
    "EXCEPT",
    "EXCLUDE",
    "EXISTS",
    "EXTRACT",
    "FALSE",
    "FETCH",
    "FOLLOWING",
    "FOR",
    "FROM",
    "FULL",
    "GRAPH_TABLE",
    "GROUP",
    "GROUPING",
    "GROUPS",
    "HASH",
    "HAVING",
    "IF",
    "IGNORE",
    "IN",
    "INNER",
    "INTERSECT",
    "INTERVAL",
    "INTO",
    "IS",
    "JOIN",
    "LATERAL",
    "LEFT",
    "LIKE",
    "LIMIT",
    "LOOKUP",
    "MERGE",
    "NATURAL",
    "NEW",
    "NO",
    "NOT",
    "NULL",
    "NULLS",
    "OF",
    "ON",
    "OR",
    "ORDER",
    "OUTER",
    "OVER",
    "PARTITION",
    "PRECEDING",
    "PROTO",
    "QUALIFY",
    "RANGE",
    "RECURSIVE",
    "RESPECT",
    "RIGHT",
    "ROLLUP",
    "ROWS",
    "SELECT",
    "SET",
    "SOME",
    "STRUCT",
    "TABLESAMPLE",
    "THEN",
    "TO",
    "TREAT",
    "TRUE",
    "UNBOUNDED",
    "UNION",
    "UNNEST",
    "USING",
    "WHEN",
    "WHERE",
    "WINDOW",
    "WITH",
    "WITHIN",
    "ALTER",
    "ANALYZE",
    "BEGIN",
    "BREAK",
    "CALL",
    "CLONE",
    "COMMIT",
    "CONSTANT",
    "CONTINUE",
    "DECLARE",
    "DELETE",
    "DESCRIBE",
    "DROP",
    "EXECUTE",
    "EXPORT",
    "GRANT",
    "INSERT",
    "ITERATE",
    "LEAVE",
    "LOAD",
    "LOOP",
    "MODULE",
    "RAISE",
    "RENAME",
    "REPEAT",
    "REPLACE",
    "RETURN",
    "REVOKE",
    "TRUNCATE",
    "UPDATE",
    "WHILE"
  ],
  "dataTypes": [
    "ARRAY",
    "BIGNUMERIC",
    "BOOL",
    "BOOLEAN",
    "BYTES",
    "DATE",
    "DATETIME",
    "DECIMAL",
    "FLOAT64",
    "GEOGRAPHY",
    "INT64",
    "INTEGER",
    "INTERVAL",
    "JSON",
    "NUMERIC",
    "RANGE",
    "STRING",
    "STRUCT",
    "TIME",
    "TIMESTAMP"
  ],
  "functions": [
    "ABS",
    "ACOS",
    "ACOSH",
    "ANY_VALUE",
    "APPROX_COUNT_DISTINCT",
    "APPROX_QUANTILES",
    "ARRAY_AGG",
    "ARRAY_CONCAT_AGG",
    "ARRAY_LENGTH",
    "ARRAY_TO_STRING",
    "ASCII",
    "ASIN",
    "ASINH",
    "ATAN",
    "ATAN2",
    "ATANH",
    "AVG",
    "BIT_AND",
    "BIT_COUNT",
    "BIT_OR",
    "BIT_XOR",
    "BYTE_LENGTH",
    "CAST",
    "CEIL",
    "CEILING",
    "CHAR_LENGTH",
    "CHARACTER_LENGTH",
    "COALESCE",
    "CONCAT",
    "CORR",
    "COS",
    "COSH",
    "COUNT",
    "COUNTIF",
    "COVAR_POP",
    "COVAR_SAMP",
    "CURRENT_DATE",
    "CURRENT_DATETIME",
    "CURRENT_TIME",
    "CURRENT_TIMESTAMP",
    "DATE",
    "DATE_ADD",
    "DATE_DIFF",
    "DATE_SUB",
    "DATE_TRUNC",
    "DATETIME_ADD",
    "DATETIME_DIFF",
    "DATETIME_SUB",
    "DATETIME_TRUNC",
    "DENSE_RANK",
    "ENDS_WITH",
    "ERROR",
    "EXP",
    "EXPONENT",
    "EXTRACT",
    "FARM_FINGERPRINT",
    "FIRST_VALUE",
    "FLOOR",
    "FORMAT",
    "FORMAT_DATE",
    "FORMAT_DATETIME",
    "FORMAT_TIME",
    "FORMAT_TIMESTAMP",
    "FROM_BASE64",
    "FROM_HEX",
    "GENERATE_ARRAY",
    "GENERATE_DATE_ARRAY",
    "GENERATE_TIMESTAMP_ARRAY",
    "GREATEST",
    "IFNULL",
    "INITCAP",
    "INSTR",
    "JSON_EXTRACT",
    "JSON_QUERY",
    "JSON_VALUE",
    "LAG",
    "LAST_VALUE",
    "LEAD",
    "LEAST",
    "LENGTH",
    "LN",
    "LOG",
    "LOG10",
    "LOGICAL_AND",
    "LOGICAL_OR",
    "LOWER",
    "LPAD",
    "LTRIM",
    "MAX",
    "MD5",
    "MIN",
    "MOD",
    "NET_HOST",
    "NTH_VALUE",
    "NTILE",
    "NULLIF",
    "OCTET_LENGTH",
    "PARSE_DATE",
    "PARSE_DATETIME",
    "PARSE_JSON",
    "PARSE_TIME",
    "PARSE_TIMESTAMP",
    "PERCENT_RANK",
    "POW",
    "POWER",
    "RANK",
    "REGEXP_CONTAINS",
    "REGEXP_EXTRACT",
    "REGEXP_EXTRACT_ALL",
    "REGEXP_INSTR",
    "REGEXP_REPLACE",
    "REPEAT",
    "REPLACE",
    "REVERSE",
    "ROUND",
    "ROW_NUMBER",
    "RPAD",
    "RTRIM",
    "SAFE_CAST",
    "SIGN",
    "SIN",
    "SINH",
    "SPLIT",
    "SQRT",
    "STARTS_WITH",
    "STDDEV",
    "STDDEV_POP",
    "STDDEV_SAMP",
    "STRING_AGG",
    "STRPOS",
    "SUBSTR",
    "SUBSTRING",
    "SUM",
    "TAN",
    "TANH",
    "TIME_ADD",
    "TIME_DIFF",
    "TIME_SUB",
    "TIME_TRUNC",
    "TIMESTAMP_ADD",
    "TIMESTAMP_DIFF",
    "TIMESTAMP_SUB",
    "TIMESTAMP_TRUNC",
    "TO_BASE64",
    "TO_CODE_POINTS",
    "TO_HEX",
    "TRANSLATE",
    "TRIM",
    "TRUNC",
    "TYPEOF",
    "UPPER"
  ],
  "lexical": {
    "lineComments": [
      "--",
      "#"
    ],
    "blockComments": [
      [
        "/*",
        "*/"
      ]
    ],
    "identifierQuotes": [
      "`"
    ],
    "stringQuotes": [
      "'",
      "\""
    ],
    "tripleStringQuotes": [
      "'''",
      "\"\"\""
    ],
    "stringPrefixes": [
      "r",
      "b",
      "br",
      "rb"
    ],
    "rawStringPrefixes": [
      "r",
      "br",
      "rb"
    ],
    "dollarQuotedStrings": false,
    "parameterModes": [
      "question",
      "atName",
      "colonName"
    ],
    "numericUnderscores": false
  }
}
